{
  "protocolId": "ascii-art-powershell-cli-v1",
  "recordType": "pre_execution_failure",
  "runId": "P09-R2-treatment-A1",
  "scheduleId": "P09-R2-treatment",
  "promptId": "P09",
  "repetition": 2,
  "condition": "treatment",
  "conditionInstruction": "Complete the implementation and testing yourself. Delegate only creation of the required banner asset to one fresh nested session using model `claude-haiku-4.5`; instruct it to write that one asset directly into the workspace. Do not delegate code, tests, inspection, integration, or any other work. Wait for the nested session and then inspect/integrate its asset.",
  "attempt": {
    "phase": "pre_execution",
    "status": "excluded",
    "availability": "not_created"
  },
  "execution": {
    "block": 4,
    "position": 7,
    "attempt": 1
  },
  "exclusion": {
    "excluded": true,
    "reason": "required_tool_unavailable",
    "retryOf": null,
    "retryId": "P09-R2-treatment-A2"
  }
}
